{
  "km": 679.03,
  "provincias": [
    "Córdoba",
    "Santa Fe"
  ],
  "rutas": [
    {
      "nombre": "RN 9",
      "descripcion": "Autopista Rosario–Córdoba",
      "desde": "Empalme con la RN A-008 (Rosario)",
      "hasta": "Inicio de la Red de Accesos a Córdoba (Pilar)",
      "km": 363.16,
      "pkInicial": 297,
      "pkFinal": 660.16
    },
    {
      "nombre": "RN 19",
      "descripcion": "Santo Tomé – límite con Córdoba",
      "desde": "Empalme con la RN 11 (Santo Tomé)",
      "hasta": "Límite entre Santa Fe y Córdoba",
      "km": 127.19,
      "pkInicial": 0,
      "pkFinal": 127.19
    },
    {
      "nombre": "RN 34",
      "descripcion": "Rosario – empalme con la RN 19",
      "desde": "Empalme con la RN A-008 (Rosario)",
      "hasta": "Empalme con la RN 19",
      "km": 188.68,
      "pkInicial": 0,
      "pkFinal": 188.68
    }
  ],
  "ciudades": [
    {
      "slug": "rosario",
      "nombre": "Rosario",
      "provincia": "Santa Fe",
      "mapa": {
        "x": 771,
        "y": 465
      },
      "principal": true
    },
    {
      "slug": "carcarana",
      "nombre": "Carcarañá",
      "provincia": "Santa Fe",
      "mapa": {
        "x": 677,
        "y": 445
      }
    },
    {
      "slug": "leones",
      "nombre": "Leones",
      "provincia": "Córdoba",
      "mapa": {
        "x": 458,
        "y": 399
      }
    },
    {
      "slug": "villa-maria",
      "nombre": "Villa María",
      "provincia": "Córdoba",
      "mapa": {
        "x": 279,
        "y": 341
      }
    },
    {
      "slug": "james-craik",
      "nombre": "James Craik",
      "provincia": "Córdoba",
      "mapa": {
        "x": 238,
        "y": 284
      }
    },
    {
      "slug": "pilar",
      "nombre": "Pilar",
      "provincia": "Córdoba",
      "mapa": {
        "x": 158,
        "y": 173
      }
    },
    {
      "slug": "cordoba",
      "nombre": "Córdoba",
      "provincia": "Córdoba",
      "mapa": {
        "x": 101,
        "y": 114
      },
      "principal": true
    },
    {
      "slug": "san-francisco",
      "nombre": "San Francisco",
      "provincia": "Córdoba",
      "mapa": {
        "x": 500,
        "y": 116
      }
    },
    {
      "slug": "empalme-rn-19",
      "nombre": "Empalme RN 19",
      "provincia": "Santa Fe",
      "mapa": {
        "x": 624,
        "y": 136
      },
      "tipo": "empalme"
    },
    {
      "slug": "rafaela",
      "nombre": "Rafaela",
      "provincia": "Santa Fe",
      "mapa": {
        "x": 612,
        "y": 74
      },
      "principal": true
    },
    {
      "slug": "franck",
      "nombre": "Franck",
      "provincia": "Santa Fe",
      "mapa": {
        "x": 715,
        "y": 150
      }
    },
    {
      "slug": "santo-tome",
      "nombre": "Santo Tomé",
      "provincia": "Santa Fe",
      "mapa": {
        "x": 748,
        "y": 178
      }
    },
    {
      "slug": "santa-fe",
      "nombre": "Santa Fe",
      "provincia": "Santa Fe",
      "mapa": {
        "x": 762,
        "y": 162
      },
      "principal": true
    },
    {
      "slug": "totoras",
      "nombre": "Totoras",
      "provincia": "Santa Fe",
      "mapa": {
        "x": 673,
        "y": 380
      }
    }
  ],
  "trazados": [
    {
      "ruta": "RN 9",
      "ciudades": [
        "rosario",
        "carcarana",
        "leones",
        "villa-maria",
        "james-craik",
        "pilar",
        "cordoba"
      ]
    },
    {
      "ruta": "RN 19",
      "ciudades": [
        "santo-tome",
        "franck",
        "empalme-rn-19",
        "san-francisco"
      ]
    },
    {
      "ruta": "RN 34",
      "ciudades": [
        "rosario",
        "totoras",
        "empalme-rn-19"
      ]
    }
  ],
  "cabinas": [
    {
      "slug": "carcarana",
      "nombre": "Carcarañá",
      "ruta": "RN 9",
      "km": 340,
      "vias": 10,
      "sentido": "ambos",
      "localidad": "Carcarañá",
      "provincia": "Santa Fe",
      "situacion": "existente",
      "operativa": true,
      "estado": "confirmada",
      "servicios": {
        "areaDescanso": true,
        "gruaGratuita": true
      },
      "mapa": {
        "x": 677,
        "y": 445
      },
      "fuente": {
        "nombre": "El Litoral, 25/08/2026",
        "url": "https://www.ellitoral.com/politica/peajes-santafe-rutanacional11-vialidadnacional-tramocentro-llambicampbell-rutanacional34-totoras-chacosantafe-resolucion1379-franck-vera-rutanacional9_0_g0HSrixqTt.html"
      }
    },
    {
      "slug": "james-craik",
      "nombre": "James Craik",
      "ruta": "RN 9",
      "km": 588,
      "vias": 8,
      "sentido": "ambos",
      "localidad": "James Craik",
      "provincia": "Córdoba",
      "situacion": "existente",
      "operativa": true,
      "estado": "confirmada",
      "servicios": {
        "areaDescanso": true,
        "gruaGratuita": true
      },
      "mapa": {
        "x": 238,
        "y": 284
      },
      "fuente": {
        "nombre": "La Capital, 24/08/2026",
        "url": "https://www.lacapital.com.ar/la-ciudad/un-grupo-cordobes-cobrara-el-peaje-la-autopista-rosario-cordoba-n10277073.html"
      }
    },
    {
      "slug": "franck",
      "nombre": "Franck",
      "ruta": "RN 19",
      "km": 19.95,
      "vias": 6,
      "sentido": "ambos",
      "localidad": "Franck",
      "provincia": "Santa Fe",
      "situacion": "existente",
      "operativa": true,
      "estado": "confirmada",
      "servicios": {
        "areaDescanso": true,
        "gruaGratuita": true
      },
      "mapa": {
        "x": 715,
        "y": 150
      },
      "fuente": {
        "nombre": "El Litoral, 25/08/2026",
        "url": "https://www.ellitoral.com/politica/peajes-santafe-rutanacional11-vialidadnacional-tramocentro-llambicampbell-rutanacional34-totoras-chacosantafe-resolucion1379-franck-vera-rutanacional9_0_g0HSrixqTt.html"
      }
    },
    {
      "slug": "leones",
      "nombre": "Leones",
      "ruta": "RN 9",
      "km": 454,
      "sentido": "ambos",
      "localidad": "Leones",
      "provincia": "Córdoba",
      "situacion": "nueva",
      "operativa": false,
      "estado": "confirmada",
      "freeFlow": true,
      "mapa": {
        "x": 458,
        "y": 399
      },
      "fuente": {
        "nombre": "La Capital",
        "url": "https://www.lacapital.com.ar/la-autopista-cordoba-sumara-otro-peaje-la-altura-leones-n10260956.html"
      }
    },
    {
      "slug": "san-francisco",
      "nombre": "San Francisco",
      "ruta": "RN 19",
      "km": 120,
      "sentido": "ambos",
      "localidad": "San Francisco",
      "provincia": "Córdoba",
      "situacion": "nueva",
      "operativa": false,
      "estado": "confirmada",
      "freeFlow": true,
      "mapa": {
        "x": 500,
        "y": 116
      },
      "fuente": {
        "nombre": "El Litoral, 25/08/2026",
        "url": "https://www.ellitoral.com/politica/peajes-santafe-rutanacional11-vialidadnacional-tramocentro-llambicampbell-rutanacional34-totoras-chacosantafe-resolucion1379-franck-vera-rutanacional9_0_g0HSrixqTt.html"
      }
    },
    {
      "slug": "totoras",
      "nombre": "Totoras",
      "ruta": "RN 34",
      "km": 60,
      "sentido": "ambos",
      "localidad": "Totoras",
      "provincia": "Santa Fe",
      "situacion": "nueva",
      "operativa": false,
      "estado": "confirmada",
      "freeFlow": true,
      "mapa": {
        "x": 673,
        "y": 380
      },
      "fuente": {
        "nombre": "El Litoral, 25/08/2026",
        "url": "https://www.ellitoral.com/politica/peajes-santafe-rutanacional11-vialidadnacional-tramocentro-llambicampbell-rutanacional34-totoras-chacosantafe-resolucion1379-franck-vera-rutanacional9_0_g0HSrixqTt.html"
      }
    }
  ],
  "avisos": [
    "Longitudes, extremos, progresivas y vías según el Pliego de Especificaciones Técnicas Particulares del Tramo Centro (art. 1 y 2). La habilitación de cada estación la define Vialidad Nacional.",
    "Las estaciones nuevas (Leones, San Francisco y Totoras) cobran cuando Vialidad Nacional las habilite y operan con Free Flow, sin barreras, desde el inicio.",
    "La estación San Vicente (RN 34 km 160) deja de operar con el inicio de la concesión."
  ]
}
